title,publication_name,publication_date,publication_year,url,authors,taxonomy_task,taxonomy_track,keywords,reference_language,citation_count,google_scholar_citation_count,publication_type,aggregation_type,subtype_description,fields_of_study,s2_fields_of_study,database,query,search_date,search_round,abstract
Multi-Granular Legal Topic Classification On Greek Legislation,"Natural Legal Language Processing, NLLP 2021 - Proceedings of the 2021 Workshop",2021-01-01,2021,https://aclanthology.org/2021.nllp-1.6,"Christos Papaloukas, Ilias Chalkidis, Konstantinos Athinaios, Despina Athanasia Pantazi, Manolis Koubarakis",Legal NLP,NLP Applications,n/a,Modern Greek,1,8,research,Conference Proceeding,Conference Paper,,,"Scopus, ACL","TITLE-ABS({Greek}) AND ALL({Natural Language Processing}) AND PUBYEAR > 2011, Greek",24/10/2023,2,"© 2021 Association for Computational Linguistics.In this work, we study the task of classifying legal texts written in the Greek language. We introduce and make publicly available a novel dataset based on Greek legislation, consisting of more than 47 thousand official, categorized Greek legislation resources. We experiment with this dataset and evaluate a battery of advanced methods and classifiers, ranging from traditional machine learning and RNN-based methods to state-of-the-art Transformer-based methods. We show that recurrent architectures with domain-specific word embeddings offer improved overall performance while being competitive even to transformer-based models. Finally, we show that cutting-edge multilingual and monolingual transformer-based models brawl on the top of the classifiers' ranking, making us question the necessity of training monolingual transfer learning models as a rule of thumb. To the best of our knowledge, this is the first time the task of Greek legal text classification is considered in an open research project, while also Greek is a language with very limited NLP resources in general."
Penelopie: Enabling Open Information Extraction For The Greek Language Through Machine Translation,"EACL 2021 - 16th Conference of the European Chapter of the Association for Computational Linguistics, Proceedings of the Student Research Workshop",2021-01-01,2021,https://aclanthology.org/2021.eacl-srw.4,"Dimitris Papadopoulos, Nikos K. Papadakis, Nikolaos F. Matsatsinis",Open Information Extraction,Information Extraction,n/a,"Modern Greek, English",3,5,research,Conference Proceeding,"Conference Paper, 'JournalArticle', 'Conference'",['Computer Science'],"[{'category': 'Computer Science', 'source': 'external'}, {'category': 'Computer Science', 'source': 's2-fos-model'}]","Scopus, ACL, Semantic Scholar","TITLE-ABS({Greek}) AND ALL({Natural Language Processing}) AND PUBYEAR > 2011, Greek, Greek+Natural+Language+Processing",24/10/2023,2,"© 2021 Association for Computational LinguisticsIn this work, we present a methodology that aims at bridging the gap between high and low-resource languages in the context of Open Information Extraction, showcasing it on the Greek language. The goals of this paper are twofold: First, we build Neural Machine Translation (NMT) models for English-to-Greek and Greek-to-English based on the Transformer architecture. Second, we leverage these NMT models to produce English translations of Greek text as input for our NLP pipeline, to which we apply a series of pre-processing and triple extraction tasks. Finally, we back-translate the extracted triples to Greek. We conduct an evaluation of both our NMT and OIE methods on benchmark datasets and demonstrate that our approach outperforms the current state-of-the-art for the Greek natural language."
Frame Semantics In The Specialized Domain Of Finance: Building A Termbase To Aid Translation,EURALEX Proceedings,2020-01-01,2021,https://euralex2020.gr/wp-content/uploads/2020/11/EURALEX2020_ProceedingsBook-p263-271.pdf,"V. Pilitsidou, Voula Giouli",frame semantics lexicon creation,Semantics:Lexical,frame semantics;FrameNet; frame;financial domain; translation; terminology;terminological resource,"Modern Greek, English",1,3,research,Conference Proceeding,Conference Paper,,,Scopus,TITLE-ABS({Greek}) AND ALL({Natural Language Processing}) AND PUBYEAR > 2011,24/10/2023,2,"© 2020, European Association for Lexicography. All rights reserved.Frame semantics (Fillmore 1977, 1982, 1985) is one of the most important developments for lexicography in the 20th century. The semantic frames approach to lexicon building and semantic representation of meaning at word and phrase level - or even beyond - has been the focus of research in computational linguistics and in Natural Language Processing. The present paper is aimed at describing completed work for the creation of a domain-specific frame-semantic lexicon in Greek (EL) and its alignment to the English (EN) FrameNet. Building on Fillmore’s Frame Semantics (Fillmore 1977, 1982, 1985) and on the example set by the FrameNet project (Baker et al. 1998), we developed a bilingual EL-EN lexical resource in the financial domain based on corpus evidence. Our motivation was two-fold: (a) to better account for the semantics of the specialized lexicon - especially the verbs and predicative nouns of the financial domain, and (b) to make cross-lingual alignments at the word level in a way that is meaningful for the translation process."
Development and validation of a corpus of written parliamentary questions in the hellenic parliament,Journal of Open Humanities Data,2021-08-04,2021,,"Fitsilis, Fotios and Mikros, George",Corpus Creation,Language Resources,Hellenic Parliament; parliamentary control; written questions; Hellenic OCR Team; crowdsourcing; open science,Modern Greek,,8,research,,,,,Scopus,TITLE-ABS({Greek}) AND ALL({Natural Language Processing}) AND PUBYEAR > 2011,24/10/2023,2,"This paper presents the development of the first parliamentary corpus of written questions in the Hellenic Parliament. Moreover, we discuss a well-defined end-to-end process that has been streamlined and optimised to produce high-quality open text data based on parliamentary documents. Based on the above methodology, a representative sample of 2,000 questions from four parliamentary periods in the Hellenic Parliament has been extracted, validated, and placed into an open data repository. Furthermore, open data production is analysed, and several degrees of freedom in its application in alternative data sets are proposed and discussed. Consequently, the authors argue that this method constitutes a transferable and scalable practice that can be used by other representative institutions for the creation and subsequent study of their open data."
Cleansing And Expanding The Hurtlex(El) With A Multidimensional Categorization Of Offensive Words,Proceedings of the Sixth Workshop on Online Abuse and Harms (WOAH),2022-07-01,2022,https://aclanthology.org/2022.woah-1.10,"Vivian Stamou, Iakovi Alexiou, Antigone Klimi, Eleftheria Molou, Alexandra Saivanidou, Stella Markantonatou",Offensive Lexicon Creation,Ethics and NLP,n/a,Modern Greek,0,0,research,Conference Proceeding,Conference Paper,,,"ACL, Scopus, Scopus","Modern Greek, TITLE-ABS({Modern Greek}) AND ALL({Natural Language Processing}) AND PUBYEAR > 2011, TITLE-ABS({Greek}) AND ALL({Natural Language Processing}) AND PUBYEAR > 2011","01/11/2022, 31/10/2022, 24/10/2023","1,2","© 2022 Association for Computational Linguistics.We present a cleansed version of the Modern Greek branch of the multilingual lexicon HURTLEX.1 The new version contains 737 offensive words. We worked bottom-up in two annotation rounds and developed detailed diagnostics of ""offensiveness"" by cross-classifying words on three dimensions: context, reference, and thematic domain. Our work reveals a wider spectrum of thematic domains concerning the study of offensive language than those identified in the Greek lexicographic literature as well as social and cultural aspects that are not included in the original HURTLEX categories."
Multilingual Name Entity Recognition And Intent Classification Employing Deep Learning Architectures,Simulation Modelling Practice and Theory,2022-11-01,2022,https://doi.org/10.1016/j.simpat.2022.102620,"S. Rizou, A. Paflioti, A. Theofilatos, Athena I. Vakali, George Sarigiannidis, Konstantinos Ch Chatzisavvas","Named Entity Recognition, Intent Classification",Information Extraction,"Named Entity Recognition, Intent Classification, Natural Language Understanding, Deep Learning, LSTM networks, Transformer networks, Conversational Agents","Modern Greek, English",0,2,research,Journal,Article,,,Scopus,TITLE-ABS({Greek}) AND ALL({Natural Language Processing}) AND PUBYEAR > 2011,24/10/2023,2,"© 2022 Elsevier B.V.Named Entity Recognition and Intent Classification are among the most important subfields of the field of Natural Language Processing. Recent research has lead to the development of faster, more sophisticated and efficient models to tackle the problems posed by those two tasks. In this work we explore the effectiveness of two separate families of Deep Learning networks for those tasks: Bidirectional Long Short-Term networks and Transformer-based networks. The models were trained and tested on the ATIS benchmark dataset for both English and Greek languages. The purpose of this paper is to present a comparative study of the two groups of networks for both languages and showcase the results of our experiments. The models, being the current state-of-the-art, yielded impressive results and achieved high performance."
How To Detect Online Hate Towards Migrants And Refugees? Developing And Evaluating A Classifier Of Racist And Xenophobic Hate Speech Using Shallow And Deep Learning,Sustainability (Switzerland),2022-10-01,2022,https://doi.org/10.3390/su142013094,"Carlos Arcila Calderón, Javier J. Amores, Patricia Sánchez-Holgado, Lazaros Vrysis, Nikolaos Vryzas, Martín Oller-Alonso",Hate Speech Detection,Ethics and NLP,hate speech; racism; xenophobia; migration; social media; deep learning,"Modern Greek, Italian, Spanish",0,1,research,Journal,Article,,,Scopus,TITLE-ABS({Greek}) AND ALL({Natural Language Processing}) AND PUBYEAR > 2011,24/10/2023,2,"© 2022 by the authors.Hate speech spreading online is a matter of growing concern since social media allows for its rapid, uncontrolled, and massive dissemination. For this reason, several researchers are already working on the development of prototypes that allow for the detection of cyberhate automatically and on a large scale. However, most of them are developed to detect hate only in English, and very few focus specifically on racism and xenophobia, the category of discrimination in which the most hate crimes are recorded each year. In addition, ad hoc datasets manually generated by several trained coders are rarely used in the development of these prototypes since almost all researchers use already available datasets. The objective of this research is to overcome the limitations of those previous works by developing and evaluating classification models capable of detecting racist and/or xenophobic hate speech being spread online, first in Spanish, and later in Greek and Italian. In the development of these prototypes, three differentiated machine learning strategies are tested. First, various traditional shallow learning algorithms are used. Second, deep learning is used, specifically, an ad hoc developed RNN model. Finally, a BERT-based model is developed in which transformers and neural networks are used. The results confirm that deep learning strategies perform better in detecting anti-immigration hate speech online. It is for this reason that the deep architectures were the ones finally improved and tested for hate speech detection in Greek and Italian and in multisource. The results of this study represent an advance in the scientific literature in this field of research, since up to now, no online anti-immigration hate detectors had been tested in these languages and using this type of deep architecture."
Domain-Specific Term Extraction: A Case Study On Greek Maritime Legal Texts,ACM International Conference Proceeding Series,2022-09-07,2022,https://doi.org/10.1145/3549737.3549751,"Despoina Mouratidis, Eirini Mathe, Yorghos Voutos, Klio Stamou, Katia Lida Kermanidis, Phivos Mylonas, Andreas Kanavos",Term Extraction,Information Extraction,Deep Learning; Domain-Specific Terms; Gaze Detection; Legal Texts; Maritime Texts; Neural Networks; Term Extraction; Text Tagging,Modern Greek,0,1,research,Conference Proceeding,Conference Paper,,,Scopus,TITLE-ABS({Greek}) AND ALL({Natural Language Processing}) AND PUBYEAR > 2011,24/10/2023,2,"© 2022 ACM.Preservation of cultural heritage has significantly attracted many research efforts. Amongst them, significant interest has been presented to sharing of cultural heritage content, whereas one major aspect of cultural content is the one concerning maritime heritage. In order to efficiently consume such content, high-quality descriptions are required. Towards this goal, we propose an approach for automatic term extraction of documents, where our methodology is based on the use of word embeddings along with a deep neural network architecture. We demonstrate its efficiency by using a large corpus of legal documents related with maritime."
Multimodal Classification Of Safety-Report Observations,Applied Sciences (Switzerland),2022-06-01,2022,https://doi.org/10.3390/app12125781,"Georgios Paraskevopoulos, Petros Pistofidis, Georgios Banoutsos, Efthymios Georgiou, V. Katsouros",Business NLP,NLP Applications,occupational safety and health (OSH); safety reports; multimodal fusion; text–visual; contrastive learning; text classific,Modern Greek,0,1,research,Journal,Article,,,Scopus,TITLE-ABS({Greek}) AND ALL({Natural Language Processing}) AND PUBYEAR > 2011,24/10/2023,2,"© 2022 by the authors. Licensee MDPI, Basel, Switzerland.Modern businesses are obligated to conform to regulations to prevent physical injuries and ill health for anyone present on a site under their responsibility, such as customers, employees and visitors. Safety officers (SOs) are engineers, who perform site audits to businesses, record observations regarding possible safety issues and make appropriate recommendations. In this work, we develop a multimodal machine-learning architecture for the analysis and categorization of safety observations, given textual descriptions and images taken from the location sites. For this, we utilize a new multimodal dataset, Safety4All, which contains 5344 safety-related observations created by 86 SOs in 486 sites. An observation consists of a short issue description, written by the SOs, accompanied with images where the issue is shown, relevant metadata and a priority score. Our proposed architecture is based on the joint fine tuning of large pretrained language and image neural network models. Specifically, we propose the use of a joint task and contrastive loss, which aligns the text and vision representations in a joint multimodal space. The contrastive loss ensures that inter-modality representation distances are maintained, so that vision and language representations for similar samples are close in the shared multimodal space. We evaluate the proposed model on three tasks, namely, priority classification of input observations, observation assessment and observation categorization. Our experiments show that inspection scene images and textual descriptions provide complementary information, signifying the importance of both modalities. Furthermore, the use of the joint contrastive loss produces strong multimodal representations and outperforms a baseline simple model in tasks fusion. In addition, we train and release a large transformer-based language model for the Greek language based on the Electra architecture."
The Financial Narrative Summarisation Shared Task (Fns 2022),Proceedings of the 4th Financial Narrative Processing Workshop @LREC2022,6/2022,2022,https://aclanthology.org/2022.fnp-1.6,"Mahmoud El-Haj, Nadhem Zmandar, Paul Rayson, Ahmed AbuRa’ed, Marina Litvak, Nikiforos Pittaras, George Giannakopoulos, Aris Kosmopoulos, Blanca Carbajo-Coronado, Antonio Moreno-Sandoval",Summarization,Summarization,n/a,"Modern Greek, English, Spanish",12,12,task overview,,,,,ACL,Greek,24/10/2023,2,"This paper presents the results and findings of the Financial Narrative Summarisation Shared Task on summarising UK, Greek and Spanish annual reports. The shared task was organised as part of the Financial Narrative Processing 2022 Workshop (FNP 2022 Workshop). The Financial Narrative summarisation Shared Task (FNS-2022) has been running since 2020 as part of the Financial Narrative Processing (FNP) workshop series (El-Haj et al., 2022; El-Haj et al., 2021; El-Haj et al., 2020b; El-Haj et al., 2019c; El-Haj et al., 2018). The shared task included one main task which is the use of either abstractive or extractive automatic summarisers to summarise long documents in terms of UK, Greek and Spanish financial annual reports. This shared task is the third to target financial documents. The data for the shared task was created and collected from publicly available annual reports published by firms listed on the Stock Exchanges of UK, Greece and Spain. A total number of 14 systems from 7 different teams participated in the shared task."
Experiments In Text Classification: Analyzing The Sentiment Of Electronic Product Reviews In Greek,Journal of Quantitative Linguistics,2022-01-01,2022,https://doi.org/10.1080/09296174.2021.1885872,Dimitris Bilianos,Document-Level Sentiment Analysis,Sentiment Analysis and Argument Mining,n/a,Modern Greek,0,2,research,Journal,Article,,,Scopus,TITLE-ABS({Greek}) AND ALL({Natural Language Processing}) AND PUBYEAR > 2011,24/10/2023,2,"© 2021 Informa UK Limited, trading as Taylor & Francis Group.Sentiment analysis, which deals with people’s sentiments as they appear in the growing amount of online social data, has been on the rise in the past few years. In its simplest form, sentiment analysis deals with the polarity of a given text, i.e., whether the opinion expressed in it is positive or negative. Sentiment analysis, or opinion mining applications on websites and the social media range from product reviews and brand reception to political issues and the stock market. The vast majority of the research in sentiment analysis has mostly dealt with English data, where there’s an abundance of readily available and annotated for sentiment corpora. With a few notable exceptions, the research in other minor languages such as Greek is lacking. This paper deals with sentiment analysis of electronic product reviews written in Greek. To this end, a small dataset of 480 positive and negative reviews is compiled and used, taken from the popular Greek e-commerce website, www.skroutz.gr. Different computational models for training and testing the dataset are evaluated, ranging from simple Naive Bayes with n-gram features to state-of-the-art BERT. The results look very promising for such a small corpus."
Multilingual Offensive Language Identification For Low-Resource Languages,ACM Transactions on Asian and Low-Resource Language Information Processing,2022-01-01,2022,https://doi.org/10.1145/3457610,"Tharindu Ranasinghe, Marcos Zampieri",Offensive Language Detection,Ethics and NLP,"Computing methodologies; Neural networks; Transfer learning; Supervised learning by classification; Offensive language identification, cross-lingual embeddings, low-resource languages","Modern Greek, English, Arabic, Bengali, Danish, Hindi, Spanish, and Turkish",3,27,research,Journal,Article,,,Scopus,TITLE-ABS({Greek}) AND ALL({Natural Language Processing}) AND PUBYEAR > 2011,24/10/2023,2,"© 2021 Copyright held by the owner/author(s). Publication rights licensed to ACM.Offensive content is pervasive in social media and a reason for concern to companies and government organizations. Several studies have been recently published investigating methods to detect the various forms of such content (e.g., hate speech, cyberbullying, and cyberaggression). The clear majority of these studies deal with English partially because most annotated datasets available contain English data. In this article, we take advantage of available English datasets by applying cross-lingual contextual word embeddings and transfer learning to make predictions in low-resource languages. We project predictions on comparable data in Arabic, Bengali, Danish, Greek, Hindi, Spanish, and Turkish. We report results of 0.8415 F1 macro for Bengali in TRAC-2 shared task [23], 0.8532 F1 macro for Danish and 0.8701 F1 macro for Greek in OffensEval 2020 [58], 0.8568 F1 macro for Hindi in HASOC 2019 shared task [27], and 0.7513 F1 macro for Spanish in in SemEval-2019 Task 5 (HatEval) [7], showing that our approach compares favorably to the best systems submitted to recent shared tasks on these three languages. Additionally, we report competitive performance on Arabic and Turkish using the training and development sets of OffensEval 2020 shared task. The results for all languages confirm the robustness of cross-lingual contextual embeddings and transfer learning for this task."
Social Media Sentiment Analysis Related To Covid-19 Vaccines: Case Studies In English And Greek Language,IFIP Advances in Information and Communication Technology,2022-01-01,2022,https://doi.org/10.1007/978-3-031-08337-2_30,"Evridiki Kapoteli, Paraskevas Koukaras, Christos Tjortjis",Sentence-Level Sentiment Analysis,Sentiment Analysis and Argument Mining,"Sentiment analysis , COVID-19 vaccines, Machine learning","Modern Greek, English",0,2,research,Book Series,Conference Paper,,,Scopus,TITLE-ABS({Greek}) AND ALL({Natural Language Processing}) AND PUBYEAR > 2011,24/10/2023,2,"© 2022, IFIP International Federation for Information Processing.SARS-CoV-2 and its mutations are spreading around the world, threatening the human population with millions of infections and deaths. Vaccines are considered the main available weapon at hand to mitigate the spread. As a result, the development of efficient systems to understand and supervise the information dissemination, as well as the evolution of sentiments towards vaccines is critical. The goal of this research was to build and apply a supervised learning approach to monitor the dynamics of public opinion on COVID-19 vaccines using Twitter data. 1,394,535 and 61,077 tweets about COVID-19 vaccines, respectively in English and Greek, were collected, classified based on sentiment polarity and analyzed over time to gain insights into sentiment trends. Our findings reveal that overall negative, neutral, and positive sentiments were at 36.5%, 39.9%, and 23.6% in the English language dataset, respectively, whereas overall negative and non-negative sentiments were at 60.1% and 39.9% in the Greek language dataset. Policymakers and health experts could take into consideration social media sentiment analysis alongside other ways of evaluating public sentiment. Social media users are actively seeking and sharing information about pandemic-related topics, allowing governments to use social media to develop effective crisis management strategies, better inform the public with accurate and reliable news, and alleviate disease-specific concerns."
Soundexgr: An Algorithm For Phonetic Matching For The Greek Language,Natural Language Engineering,2022-01-01,2022,https://doi.org/10.1017/S1351324922000018,"Antrei Kavros, Yannis Tzitzikas",Grammatical Error Correction,"Syntax: Tagging, Chunking and Parsing",Phonetic algorithms; Greek language; Phonetic matching; Phonemic matching,Modern Greek,1,1,research,Journal,Article,,"[{'category': 'Computer Science', 'source': 's2-fos-model'}]","Scopus, Semantic Scholar","TITLE-ABS({Greek}) AND ALL({Natural Language Processing}) AND PUBYEAR > 2011, Greek+Natural+Language+Processing",24/10/2023,2,"© The Author(s), 2022. Published by Cambridge University Press.Text usually suffers from typos which can negatively affect various Information Retrieval and Natural Language Processing tasks. Although there is a wide variety of choices for tackling this issue in the English language, this is not the case for other languages. For the Greek language, most of the existing phonetic algorithms provide rather insufficient support. For this reason, in this paper, we introduce an algorithm for phonetic matching designed for the Greek language: we start from the original Soundex and we redesign and extend it for accommodating the Greek language's phonetic rules, ending up to a family of algorithms, that we call <![CDATA[ ${\tt Soundex}_{GR}$ ]]>. Then, we report various experimental results showcasing how the algorithm behaves in different scenarios, and we provide comparative results for various parameters of the algorithm for revealing the trade-off between precision and recall in datasets with different kinds of errors. We also provide comparative results with matching using stemming, full phonemic transcription, and edit distance, that demonstrate that <![CDATA[ ${\tt Soundex}_{GR}$ ]]> performs better (indicatively, it achieves F-Score over 95% in collections of similar-sounded words). The simplicity, efficiency, and effectiveness of the proposed algorithm make it applicable and adaptable to a wide range of tasks."
