title,publication_name,publication_date,publication_year,url,authors,taxonomy_task,taxonomy_track,keywords,reference_language,citation_count,google_scholar_citation_count,publication_type,aggregation_type,subtype_description,fields_of_study,s2_fields_of_study,database,query,search_date,search_round,abstract
"Named Entity Recognition, Linking And Generation For Greek Legislation",Frontiers in Artificial Intelligence and Applications,2018-01-01,2018,https://doi.org/10.3233/978-1-61499-935-5-1,"Iosif Angelidis, Ilias Chalkidis, Manolis Koubarakis","Named Entity Recognition, Entity Linking",Information Extraction,"Named Entity Recognition and Linking, Dataset Generation, Entity Reference Representation, Deep Learning",Modern Greek,10,33,research,Book Series,Conference Paper,,,Scopus,TITLE-ABS({Greek}) AND ALL({Natural Language Processing}) AND PUBYEAR > 2011,24/10/2023,2,"© 2018 The authors and IOS Press.We investigate named entity recognition in Greek legislation using stateof- the-art deep neural network architectures. The recognized entities are used to enrich the Greek legislation knowledge graph with more detailed information about persons, organizations, geopolitical entities, legislation references, geographical landmarks and public document references.We also interlink the textual references of the recognized entities to the corresponding entities represented in other open public datasets and, in this way, we enable new sophisticated ways of querying Greek legislation. Relying on the results of the aforementioned methods we generate and publish a new dataset of geographical landmarks mentioned in Greek legislation. We make available publicly all datasets and other resources used in our study. Our work is the first of its kind for the Greek language in such an extended form and one of the few that examines legal text in a full spectrum, for both entity recognition and linking."
A novel rule based machine translation scheme from Greek to Greek Sign Language: Production of different types of large corpora and Language Models evaluation,Computer Speech & Language,,2018,,"Kouremenos, D., Ntalianis, K., & Kollias, S.",Rule-Based Machine Translation,Machine Translation,Machine translation; Greek Sign Language; GSL; Deaf people communication,"Modern Greek, Greek Sign Language",,18,research,,,,,Google Scholar,"""toxicity detection"" greek nlp",11/23/2023,quality_assurance,"One of the aims of assistive technologies is to help people with disabilities to communicate with others and to provide means of access to information. As an aid to Deaf people, in this work we present a novel prototype Rule Based Machine Translation (RBMT) system for the creation of large and quality written Greek Sign Language (GSL) glossed corpora from Greek text. In particular, the proposed RBMT system assists the professional GSL translator in speeding up the production of different kinds of GSL glossed corpora. Then each glossed corpus is used for the production/creation of Language Model (LM) n-grams. With the GSL glossed corpus from Greek text, we can build, test and evaluate different kinds of Language Models for different kinds of glossed GSL corpora. Here, it should be noted that it does not require grammar knowledge of GSL but only very basic GSL phenomena covered by manual RBMT rules as it assists the professional human translator. Furthermore, it should also be stressed that Language Models for written GSL gloss are missing from the scientific literature, thus this work is pioneer in this field. Evaluation of the proposed scheme is carried out for the weather reports domain, where 20,284 tokens and 1000 sentences have been produced. By using the BiLingual Evaluation Understudy (BLEU) metric score, our prototype RBMT system achieves a relative score of 0.84 (84%) for 4-grams and 0.9 (90%) for 1-grams."
Design And Implementation Of An Open Source Greek Pos Tagger And Entity Recognizer Using Spacy,"Proceedings - 2019 IEEE/WIC/ACM International Conference on Web Intelligence, WI 2019",2019-10-14,2019,https://doi.org/10.1145/3350546.3352543,"Eleni Partalidou, Eleftherios Spyromitros-Xioufis, Stavros Doropoulos, Stavros Vologiannidis, Konstantinos I. Diamantaras","Named Entity Recognition, POS tagging","Information Extraction; Syntax: Tagging, Chunking and Parsing","Part-of-Speech Tagging, Named Entity Recognition, spaCy, Greek text",Modern Greek,19,27,research,Conference Proceeding,"Conference Paper, 'JournalArticle', 'Book', 'Conference'","['Computer Science', 'Mathematics']","[{'category': 'Computer Science', 'source': 'external'}, {'category': 'Mathematics', 'source': 'external'}, {'category': 'Computer Science', 'source': 's2-fos-model'}]","Scopus, Semantic Scholar","TITLE-ABS({Greek}) AND ALL({Natural Language Processing}) AND PUBYEAR > 2011, Greek+Natural+Language+Processing",24/10/2023,2,"© 2019 Copyright held by the owner/author(s). Publication rights licensed to ACM.This paper proposes a machine learning approach to part-of-speech tagging and named entity recognition for Greek, focusing on the extraction of morphological features and classification of tokens into a small set of classes for named entities. The architecture model that was used is introduced. The greek version of the spaCy platform was added into the source code, a feature that did not exist before our contribution, and was used for building the models. Additionally, a part of speech tagger was trained that can detect the morphology of the tokens and performs higher than the state-of-the-art results when classifying only the part of speech. For named entity recognition using spaCy, a model that extends the standard ENAMEX type (organization, location, person) was built. Certain experiments that were conducted indicate the need for flexibility in out-of-vocabulary words and there is an effort for resolving this issue. Finally, the evaluation results are discussed."
A Hybrid Method For Sentiment Analysis Of Election Related Tweets,"2019 4th South-East Europe Design Automation, Computer Engineering, Computer Networks and Social Media Conference, SEEDA-CECNSM 2019",2019-09-01,2019,https://doi.org/10.1109/SEEDA-CECNSM.2019.8908289,"Dimosthenis Beleveslis, Christos Tjortjis, Dimitris Psaradelis, Dimitris Nikoglou",Document-Level Sentiment Analysis,Sentiment Analysis and Argument Mining,"Sentiment Analysis, Natural language processing, Supervised learning, Classification, Social Media and etechnologies",Modern Greek,7,14,research,Conference Proceeding,Conference Paper,,,Scopus,TITLE-ABS({Greek}) AND ALL({Natural Language Processing}) AND PUBYEAR > 2011,24/10/2023,2,"© 2019 IEEE.Political sentiment analysis using social media content has recently attracted significant interest. This paper focuses on analyzing tweets in Greek regarding the recent European Elections. A hybrid method that combines Greek lexicons and classification methods is presented. A probabilistic classification model, that predicts the sentiment of tweets, is combined with hashtag-based filtering. Based on the predictions, an analysis is implemented, that shows how the public sentiment was affected by specific events during the pre-election period."
Examining The Impact Of Discretization Technique On Sentiment Analysis For The Greek Language,"10th International Conference on Information, Intelligence, Systems and Applications, IISA 2019",2019-07-01,2019,https://doi.org/10.1109/IISA.2019.8900699,"Nikolaos Spatiotis, Isidoros Perikos, Iosif Mporas, Michael Paraskevas",Document-Level Sentiment Analysis,Sentiment Analysis and Argument Mining,"text mining, sentiment analysis, machine learning discretization, feature engineering",Modern Greek,3,5,research,Conference Proceeding,Conference Paper,,,Scopus,TITLE-ABS({Greek}) AND ALL({Natural Language Processing}) AND PUBYEAR > 2011,24/10/2023,2,"© 2019 IEEE.Nowadays, information, communication and interaction between people worldwide have been facilitated by the rapid development of technology and they are mainly achieved through the internet. Internet users are now new creators of information data and express their ideas, their opinions, their feelings and their attitudes about products and services rather than passive information recipients. Given the evolution of modern technological advances, such as the proliferation of mobile devices social networks and services is extending. User-generated content in social media constitutes a very meaningful information source and consists of opinions towards various events and services. In this paper, we present a methodology that aims to analyze Greek text and extract indicative info towards users' opinions and attitudes. Specifically, we describe a supervised approach adopted that analyzes and classifies comments and reviews into the appropriate polarity category. Discretization techniques are also applied to improve the performance and the accuracy of classification procedures. Finally, we present an experimental evaluation that was designed and conducted and which revealed quite interesting findings."
Xlda: Cross-Lingual Data Augmentation For Natural Language Inference And Question Answering,CoRR,2019-05-27 0:00:00,2019,https://www.semanticscholar.org/paper/c846cbb24866af99a8d02d4c73aa4d7dd1831538,"Jasdeep Singh, Bryan McCann, N. Keskar, Caiming Xiong, R. Socher",Cross-Lingual Data Augmentation,Multilingualism and Cross-Lingual NLP,n/a,"Modern Greek, English, French, Spanish, German, Bulgarian, Russian, Turkish, Arabic, Vietnamese, Chinese, Hindi, Swahili, Urdu",57,56,research,,JournalArticle',['Computer Science'],"[{'category': 'Computer Science', 'source': 'external'}, {'category': 'Computer Science', 'source': 's2-fos-model'}, {'category': 'Linguistics', 'source': 's2-fos-model'}]",Semantic Scholar,Greek+Natural+Language+Processing,24/10/2023,2,"While natural language processing systems often focus on a single language, multilingual transfer learning has the potential to improve performance, especially for low-resource languages. We introduce XLDA, cross-lingual data augmentation, a method that replaces a segment of the input text with its translation in another language. XLDA enhances performance of all 14 tested languages of the cross-lingual natural language inference (XNLI) benchmark. With improvements of up to $4.8\%$, training with XLDA achieves state-of-the-art performance for Greek, Turkish, and Urdu. XLDA is in contrast to, and performs markedly better than, a more naive approach that aggregates examples in various languages in a way that each example is solely in one language. On the SQuAD question answering task, we see that XLDA provides a $1.0\%$ performance increase on the English evaluation set. Comprehensive experiments suggest that most languages are effective as cross-lingual augmentors, that XLDA is robust to a wide range of translation quality, and that XLDA is even more effective for randomly initialized models than for pretrained models."
A Comparative Assessment Of The Difficulty Of Authorship Attribution In Greek And In English,Journal of the Association for Information Science and Technology,2019-01-01,2019,https://doi.org/10.1002/asi.24073,"Patrick Juola, George K. Mikros, Sean Vinsick",Authorship Attribution,Authorship Analysis,n/a,"Modern Greek, English",5,6,research,Journal,Article,,,Scopus,TITLE-ABS({Greek}) AND ALL({Natural Language Processing}) AND PUBYEAR > 2011,24/10/2023,2,"© 2018 ASIS&TAuthorship attribution is an important problem in text classification, with many applications and a substantial body of research activity. Among the research findings are that many different methods will work, including a number of methods that are superficially language-independent (such as an analysis of the most common “words” or “character n-grams” in a document). Since all languages have words (and all written languages have characters), this method could (in theory) work on any language. However, it is not clear that the methods that work best on, for example English, would also work best on other languages. It is not even clear that the same level of performance is achievable in different languages, even under identical conditions. Unfortunately, it is very difficult to achieve “identical conditions” in practice. A new corpus, developed by George Mikros, provides very tight controls not only for author but also for topic, thus enabling a direct comparison of performance levels between the two languages Greek and English. We compare a number of different methods head-to-head on this corpus, and show that, overall, performance on English is higher than performance on Greek, often highly significantly so."
Ensemble And Deep Learning For Language-Independent Automatic Selection Of Parallel Data,Algorithms,2019-01-01,2019,https://doi.org/10.3390/a12010026,"Despoina Mouratidis, Katia Lida Kermanidis",Machine Translation Evaluation,Machine Translation,machine learning; deep learning; education data; data selection; machine translation; DL4J deep learning architecture; random forest,"Modern Greek, English, Italian",4,7,research,Journal,Article,,,Scopus,TITLE-ABS({Greek}) AND ALL({Natural Language Processing}) AND PUBYEAR > 2011,24/10/2023,2,"© 2018 by the authors.Machine translation is used in many applications in everyday life. Due to the increase of translated documents that need to be organized as useful or not (for building a translation model), the automated categorization of texts (classification), is a popular research field of machine learning. This kind of information can be quite helpful for machine translation. Our parallel corpora (English-Greek and English-Italian) are based on educational data, which are quite difficult to translate. We apply two state of the art architectures, Random Forest (RF) and Deeplearnig4j (DL4J), to our data (which constitute three translation outputs). To our knowledge, this is the first time that deep learning architectures are applied to the automatic selection of parallel data. We also propose new string-based features that seem to be effective for the classifier, and we investigate whether an attribute selection method could be used for better classification accuracy. Experimental results indicate an increase of up to 4% (compared to our previous work) using RF and rather satisfactory results using DL4J."
Greek-Bert: The Greeks Visiting Sesame Street,ACM International Conference Proceeding Series,2020-09-02,2020,https://doi.org/10.1145/3411408.3411440,"John Koutsikakis, Ilias Chalkidis, Prodromos Malakasiotis, Ion Androutsopoulos","Language Modeling, Named Entity Recognition, POS tagging, Natural Language Inference","Machine Learning for NLP; Information Extraction; Syntax: Tagging, Chunking and Parsing; Semantics: Sentence-level Semantics","Deep Neural Networks, Natural Language Processing, Pre-trained Language Models, Transformers, Greek NLP Resources",Modern Greek,38,63,research,Conference Proceeding,"Conference Paper, Conference Paper, 'JournalArticle', 'Book'",['Computer Science'],"[{'category': 'Computer Science', 'source': 'external'}, {'category': 'Computer Science', 'source': 's2-fos-model'}]","Scopus, Scopus, Semantic Scholar","TITLE-ABS({Modern Greek}) AND ALL({Natural Language Processing}) AND PUBYEAR > 2011, TITLE-ABS({Greek}) AND ALL({Natural Language Processing}) AND PUBYEAR > 2011, Greek+Natural+Language+Processing","31/10/2022, 24/10/2023","1,2","© 2020 ACM.Transformer-based language models, such as BERT and its variants, have achieved state-of-the-art performance in several downstream natural language processing (NLP) tasks on generic benchmark datasets (e.g., GLUE, SQUAD, RACE). However, these models have mostly been applied to the resource-rich English language. In this paper, we present GREEK-BERT, a monolingual BERT -based language model for modern Greek. We evaluate its performance in three NLP tasks, i.e., part-of-speech tagging, named entity recognition, and natural language inference, obtaining state-of-the-art performance. Interestingly, in two of the benchmarks GREEK-BERT outperforms two multilingual Transformer-based models (M-BERT, XLM-R), as well as shallower neural baselines operating on pre-trained word embeddings, by a large margin (5%-10%). Most importantly, we make both GREEK-BERT and our training code publicly available, along with code illustrating how GREEK-BERT can be fine-tuned for downstream NLP tasks. We expect these resources to boost NLP research and applications for modern Greek."
Studying The Evolution Of Greek Words Via Word Embeddings,ACM International Conference Proceeding Series,2020-09-02,2020,10.1145/3411408.3411425,"Vasileios Barzokas, Eirini Papagiannopoulou, Grigorios Tsoumakas",semantic shift detection,Semantics:Lexical,"diachronic word embeddings, semantic shifts, k nearest neighbours, Greek language, Computing methodologies→Lexical semantics;  Applied computing→Document management and text processing",Modern Greek,1,1,research,Conference Proceeding,"Conference Paper, Conference Paper, 'JournalArticle', 'Book'",['Computer Science'],"[{'category': 'Computer Science', 'source': 'external'}, {'category': 'Computer Science', 'source': 's2-fos-model'}]","Scopus, Scopus, Semantic Scholar","TITLE-ABS({Modern Greek}) AND ALL({Natural Language Processing}) AND PUBYEAR > 2011, TITLE-ABS({Greek}) AND ALL({Natural Language Processing}) AND PUBYEAR > 2011, Greek+Natural+Language+Processing","31/10/2022, 24/10/2023","1,2","© 2020 ACM.The meanings of words change over time, reflecting changes in language and society (political, economic or cultural). This study focuses on the more recent form of modern Greek, i.e. Demotic, also known as Dimotiki, aiming to trace semantic shifts of Greek words between consecutive time periods. We develop a systematic framework that gathers free online Greek digitized literature books and analyzes them using natural language processing tools to learn representations of human language. Then, we conduct an experimental analysis to evaluate the quality of our trained models as well as their ability to detect semantic shifts. We present representative results of actual semantic shifts in Greek words in the period 1980 to 2020."
An Evaluation Of Neural Machine Translation And Pre-Trained Word Embeddings In Multilingual Neural Sentiment Analysis,"Proceedings of 2020 IEEE International Conference on Progress in Informatics and Computing, PIC 2020",2020-12-18,2020,https://doi.org/10.1109/PIC50277.2020.9350849,"George Manias, Argyro Mavrogiorgou, Athanasios Kiourtis, Dimosthenis Kyriazis",Document-Level Sentiment Analysis,Sentiment Analysis and Argument Mining,"neural sentiment analysis, neural machine translation, deep learning, word embeddings (key words)","Modern Greek, German",2,4,research,Conference Proceeding,"Conference Paper, 'Conference'",,"[{'category': 'Computer Science', 'source': 's2-fos-model'}]","Scopus, Semantic Scholar","TITLE-ABS({Greek}) AND ALL({Natural Language Processing}) AND PUBYEAR > 2011, Greek+Natural+Language+Processing",24/10/2023,2,"© 2020 IEEE.One of the main elements in several application domains, such as policy making, addresses the scope of public opinion analysis. The latter is recently realized through sentiment analysis and Natural Language Processing, for identifying and extracting subjective information from raw texts. An additional challenge refers to the exploitation and correlation of data from different languages, in order to analyse sentiments by considering all available information in a holistic way. This paper investigates the impact of Neural Machine Translation in sentiment analysis, based on the translation of text for which neural sentiment analysis in English has been already applied and is applied again on the translated German and Greek texts. The latter is performed through the same Neural Network models that were used in the original language, in order to analyse the differences between the performed neural sentiment analysis on the source and the target languages. The outcomes of the proposed approach have a twofold interpretation. While, it is concluded that modern Neural Machine Translation tools are mature enough to provide high accuracy translations and have minor impact on multilingual sentiment analysis, on the other hand it is shown that additional research should be performed on the multilingualism that pre-trained Word Embeddings can provide."
A Graph Neural Network For Assessing The Affective Coherence Of Twitter Graphs,"Proceedings - 2020 IEEE International Conference on Big Data, Big Data 2020",2020-12-10,2020,https://doi.org/10.1109/BigData50022.2020.9378492,"Georgios Drakopoulos, Ioanna Giannoukou, Phivos Mylonas, Spyros A. Sioutas",Sentence-Level Sentiment Analysis,Sentiment Analysis and Argument Mining,"graph neural networks, social graph resiliency, affective coherency, linked data, high dimensional data","Modern Greek, English?",5,18,research,Conference Proceeding,Conference Paper,,,Scopus,TITLE-ABS({Greek}) AND ALL({Natural Language Processing}) AND PUBYEAR > 2011,24/10/2023,2,"© 2020 IEEE.Graph neural networks (GNNs) is an emerging class of iterative connectionist models taking full advantage of the interaction patterns in an underlying domain. Depending on their configuration GNNs aggregate local state information to obtain robust estimates of global properties. Since graphs inherently represent high dimensional data, GNNs can effectively perform dimensionality reduction for certain aggregator selections. One such task is assigning sentiment polarity labels to the vertices of a large social network based on local ground truth state vectors containing structural, functional, and affective attributes. Emotions have been long identified as key factors in the overall social network resiliency and determining such labels robustly would be a major indicator of it. As a concrete example, the proposed methodology has been applied to two benchmark graphs obtained from political Twitter with topic sampling regarding the Greek 1821 Independence Revolution and the US 2020 Presidential Elections. Based on the results recommendations for researchers and practitioners are offered."
An Ensemble Method For Producing Word Representations Focusing On The Greek Language,Proceedings of the 3rd Workshop on Technologies for MT of Low Resource Languages,12/2020,2020,https://aclanthology.org/2020.loresmt-1.13,"Michalis Lioudakis, Stamatis Outsios, Michalis Vazirgiannis",distributional semantic modeling,Semantics:Lexical,n/a,"Modern Greek, English",,3,research,,,,,ACL,Greek,24/10/2023,2,"In this paper we present a new ensemble method, Continuous Bag-of-Skip-grams (CBOS), that produces high-quality word representations putting emphasis on the Greek language. The CBOS method combines the pioneering approaches for learning word representations: Continuous Bag-of-Words (CBOW) and Continuous Skip-gram. These methods are compared through intrinsic and extrinsic evaluation tasks on three different sources of data: the English Wikipedia corpus, the Greek Wikipedia corpus, and the Greek Web Content corpus. By comparing these methods across different tasks and datasets, it is evident that the CBOS method achieves state-of-the-art performance."
Virtual Learning Communities (Vlcs) Rethinking: Influence On Behavior Modification—Bullying Detection Through Machine Learning And Natural Language Processing,Journal of Computers in Education,2020-12-01,2020,https://doi.org/10.1007/s40692-020-00166-5,"Stefanos Nikiforos, Spyros Tzanavaris, Katia Lida Kermanidis",Bullying Detection,Ethics and NLP,Virtual learning community-VLC · Bullying · Natural language processing-NLP · Inner speech · Teacher’s role · Machine learning,Modern Greek,11,17,research,Journal,Article,,,Scopus,TITLE-ABS({Greek}) AND ALL({Natural Language Processing}) AND PUBYEAR > 2011,24/10/2023,2,"© 2020, Beijing Normal University.The current study attempts to investigate the influence of virtual learning communities (VLCs) on behavior modification, through the bullying paradigm, using natural language processing (NLP) techniques. The key question is whether individual learners that bully in their physical learning community (PLC) can be able to exhibit a behavior modification, if integrated in a VLC. Results indicate that the attempted ""integration"" could be a promising framework to behavior modification via a virtual community. Furthermore, machine learning is employed for the automatic detection of aggressive behavior that can facilitate the timely teacher's intervention, without him having to manually scan through the textual dataset. To the authors' knowledge, this is the first time such a linguistic and behavioral analysis for bullying detection is applied to VLCs. Another innovative challenge is the language targeted in the analysis, namely Greek."
